{
 "about": "Word forms for words outside the word list (content/igloo/words/de.json): verbs as '3rd person present · Präteritum · Perfekt' like the word list's forms; nouns as [article, plural] ('-' no article, 'pl' plural only, '' no plural); adjectives with an irregular comparison as [comparative, superlative]; examples: [German, English] for word-list words whose own example does not hold the word (a card shows one example). Validated by src/domain/forms.js validateForms.",
 "examples": {
  "die_Achtsamkeit": ["Im Yogakurs üben wir Achtsamkeit.", "In the yoga class we practise mindfulness."],
  "die_Unverträglichkeit": ["Sie hat eine Unverträglichkeit gegen Milch.", "She has an intolerance to milk."],
  "der_Maler": ["Der Maler streicht morgen unsere Küche.", "The painter is painting our kitchen tomorrow."],
  "der_Wein": ["Zum Essen trinken wir ein Glas Wein.", "We have a glass of wine with the meal."],
  "der_Saft": ["Zum Frühstück trinke ich einen Saft.", "I have a juice for breakfast."],
  "der_Vegetarier": ["Mein Bruder ist Vegetarier und isst kein Fleisch.", "My brother is a vegetarian and doesn't eat meat."],
  "der_Kürbis": ["Im Herbst kaufen wir einen Kürbis auf dem Markt.", "In autumn we buy a pumpkin at the market."],
  "der_Journalist": ["Der Journalist stellt dem Minister viele Fragen.", "The journalist asks the minister a lot of questions."],
  "das_Pech": ["Wir hatten im Urlaub viel Pech mit dem Wetter.", "We had a lot of bad luck with the weather on holiday."],
  "die_Pflicht": ["Pünktlichkeit ist bei uns eine Pflicht.", "Here, being on time is an obligation."],
  "das_Verbot": ["Im Park gilt ein Verbot für Hunde.", "There is a ban on dogs in the park."],
  "die_Figur": ["Die wichtigste Figur im Roman ist eine junge Ärztin.", "The most important character in the novel is a young doctor."],
  "der_Feinstaub": ["In der Stadt ist die Luft voller Feinstaub.", "In the city the air is full of fine dust."]
 },
 "verbs": {
  "beauftragen": "beauftragt · beauftragte · hat beauftragt",
  "erneuern": "erneuert · erneuerte · hat erneuert",
  "bellen": "bellt · bellte · hat gebellt",
  "führen": "führt · führte · hat geführt",
  "verweigern": "verweigert · verweigerte · hat verweigert",
  "stinken": "stinkt · stank · hat gestunken",
  "beißen": "beißt · biss · hat gebissen",
  "reinigen": "reinigt · reinigte · hat gereinigt",
  "gestatten": "gestattet · gestattete · hat gestattet",
  "herrschen": "herrscht · herrschte · hat geherrscht",
  "leeren": "leert · leerte · hat geleert",
  "kontrollieren": "kontrolliert · kontrollierte · hat kontrolliert",
  "aufbauen": "baut auf · baute auf · hat aufgebaut",
  "ausräumen": "räumt aus · räumte aus · hat ausgeräumt",
  "abstellen": "stellt ab · stellte ab · hat abgestellt",
  "übernehmen": "übernimmt · übernahm · hat übernommen",
  "aushängen": "hängt aus · hängte aus · hat ausgehängt",
  "loswerden": "wird los · wurde los · ist losgeworden",
  "mitentscheiden": "entscheidet mit · entschied mit · hat mitentschieden",
  "zurückzahlen": "zahlt zurück · zahlte zurück · hat zurückgezahlt",
  "überlassen": "überlässt · überließ · hat überlassen",
  "zurückziehen": "zieht zurück · zog zurück · hat/ist zurückgezogen",
  "abbrechen": "bricht ab · brach ab · hat abgebrochen",
  "abschaffen": "schafft ab · schaffte ab · hat abgeschafft",
  "absprechen": "spricht ab · sprach ab · hat abgesprochen",
  "sich abwechseln": "wechselt sich ab · wechselte sich ab · hat sich abgewechselt",
  "anerkennen": "erkennt an · erkannte an · hat anerkannt",
  "anfordern": "fordert an · forderte an · hat angefordert",
  "angeben": "gibt an · gab an · hat angegeben",
  "anstellen": "stellt an · stellte an · hat angestellt",
  "aufnehmen": "nimmt auf · nahm auf · hat aufgenommen",
  "aufteilen": "teilt auf · teilte auf · hat aufgeteilt",
  "ausprobieren": "probiert aus · probierte aus · hat ausprobiert",
  "austauschen": "tauscht aus · tauschte aus · hat ausgetauscht",
  "beachten": "beachtet · beachtete · hat beachtet",
  "bedienen": "bedient · bediente · hat bedient",
  "befragen": "befragt · befragte · hat befragt",
  "begleiten": "begleitet · begleitete · hat begleitet",
  "belasten": "belastet · belastete · hat belastet",
  "bemerken": "bemerkt · bemerkte · hat bemerkt",
  "benötigen": "benötigt · benötigte · hat benötigt",
  "sich beteiligen": "beteiligt sich · beteiligte sich · hat sich beteiligt",
  "betragen": "beträgt · betrug · hat betragen",
  "bewerten": "bewertet · bewertete · hat bewertet",
  "bewegen": "bewegt · bewegte · hat bewegt",
  "bezeichnen": "bezeichnet · bezeichnete · hat bezeichnet",
  "eingehen": "geht ein · ging ein · ist eingegangen",
  "einhalten": "hält ein · hielt ein · hat eingehalten",
  "entfernen": "entfernt · entfernte · hat entfernt",
  "entsorgen": "entsorgt · entsorgte · hat entsorgt",
  "enthalten": "enthält · enthielt · hat enthalten",
  "erleben": "erlebt · erlebte · hat erlebt",
  "ernten": "erntet · erntete · hat geerntet",
  "genießen": "genießt · genoss · hat genossen",
  "klagen": "klagt · klagte · hat geklagt",
  "lagern": "lagert · lagerte · hat gelagert",
  "lenken": "lenkt · lenkte · hat gelenkt",
  "nachdenken": "denkt nach · dachte nach · hat nachgedacht",
  "retten": "rettet · rettete · hat gerettet",
  "schaden": "schadet · schadete · hat geschadet",
  "stoßen": "stößt · stieß · hat/ist gestoßen",
  "veranstalten": "veranstaltet · veranstaltete · hat veranstaltet",
  "verbinden": "verbindet · verband · hat verbunden",
  "verbreiten": "verbreitet · verbreitete · hat verbreitet",
  "verwenden": "verwendet · verwendete · hat verwendet",
  "wegwerfen": "wirft weg · warf weg · hat weggeworfen",
  "wiegen": "wiegt · wog · hat gewogen",
  "zerstören": "zerstört · zerstörte · hat zerstört",
  "zusammenarbeiten": "arbeitet zusammen · arbeitete zusammen · hat zusammengearbeitet",
  "aufhängen": "hängt auf · hängte auf · hat aufgehängt",
  "abreißen": "reißt ab · riss ab · hat abgerissen",
  "anbauen": "baut an · baute an · hat angebaut",
  "anmerken": "merkt an · merkte an · hat angemerkt",
  "bereitstellen": "stellt bereit · stellte bereit · hat bereitgestellt",
  "betreten": "betritt · betrat · hat betreten",
  "bieten": "bietet · bot · hat geboten",
  "drehen": "dreht · drehte · hat gedreht",
  "sich erkundigen": "erkundigt sich · erkundigte sich · hat sich erkundigt",
  "fließen": "fließt · floss · ist geflossen",
  "graben": "gräbt · grub · hat gegraben",
  "greifen": "greift · griff · hat gegriffen",
  "heben": "hebt · hob · hat gehoben",
  "klingen": "klingt · klang · hat geklungen",
  "leiden": "leidet · litt · hat gelitten",
  "reiten": "reitet · ritt · hat/ist geritten",
  "riechen": "riecht · roch · hat gerochen",
  "schieben": "schiebt · schob · hat geschoben",
  "schießen": "schießt · schoss · hat geschossen",
  "schmelzen": "schmilzt · schmolz · hat/ist geschmolzen",
  "streichen": "streicht · strich · hat gestrichen",
  "treten": "tritt · trat · hat/ist getreten",
  "werben": "wirbt · warb · hat geworben",
  "gründen": "gründet · gründete · hat gegründet",
  "mähen": "mäht · mähte · hat gemäht",
  "hupen": "hupt · hupte · hat gehupt",
  "jubeln": "jubelt · jubelte · hat gejubelt",
  "schimpfen": "schimpft · schimpfte · hat geschimpft"
 },
 "nouns": {
  "etwas Lustiges": ["-", ""],
  "Ingenieurbüro": ["das", "Ingenieurbüros"],
  "Werkraum": ["der", "Werkräume"],
  "Namensschild": ["das", "Namensschilder"],
  "Firmenchefin": ["die", "Firmenchefinnen"],
  "Verkaufsraum": ["der", "Verkaufsräume"],
  "Nussallergie": ["die", "Nussallergien"],
  "Schokoladenfabrik": ["die", "Schokoladenfabriken"],
  "Umzugsfirma": ["die", "Umzugsfirmen"],
  "Universitätsstadt": ["die", "Universitätsstädte"],
  "Münster": ["-", ""],
  "Potsdam": ["-", ""],
  "Wohnpartnerschaft": ["die", "Wohnpartnerschaften"],
  "Beraterin": ["die", "Beraterinnen"],
  "Einzug": ["der", "Einzüge"],
  "Zigarettenrauch": ["der", ""],
  "Nachbarschaftsmediation": ["die", "Nachbarschaftsmediationen"],
  "Streitende": ["der/die", "Streitenden"],
  "Zaun": ["der", "Zäune"],
  "Rauch": ["der", ""],
  "Gerichtsverfahren": ["das", "Gerichtsverfahren"],
  "Streitigkeit": ["die", "Streitigkeiten"],
  "Monatsmiete": ["die", "Monatsmieten"],
  "Bohrmaschine": ["die", "Bohrmaschinen"],
  "Werkzeug": ["das", "Werkzeuge"],
  "Schleifgerät": ["das", "Schleifgeräte"],
  "Öffnungszeiten": ["pl", ""],
  "Nachbarschaftscafé": ["das", "Nachbarschaftscafés"],
  "Mietwohnung": ["die", "Mietwohnungen"],
  "Fliege": ["die", "Fliegen"],
  "Geruch": ["der", "Gerüche"],
  "Mietshaus": ["das", "Mietshäuser"],
  "Unsinn": ["der", ""],
  "Kinderwagen": ["der", "Kinderwagen"],
  "Eingangsbereich": ["der", "Eingangsbereiche"],
  "Fahrradkeller": ["der", "Fahrradkeller"],
  "Mülltonne": ["die", "Mülltonnen"],
  "Sperrmüll": ["der", ""],
  "Tonne": ["die", "Tonnen"],
  "Trockner": ["der", "Trockner"],
  "Belegungsplan": ["der", "Belegungspläne"],
  "Nutzung": ["die", "Nutzungen"],
  "Benutzung": ["die", ""],
  "Filter": ["der", "Filter"],
  "Holzkohle": ["die", ""],
  "Gemeinschaftsgarten": ["der", "Gemeinschaftsgärten"],
  "Kundenkarte": ["die", "Kundenkarten"],
  "Möbelhaus": ["das", "Möbelhäuser"],
  "Gästeparkplatz": ["der", "Gästeparkplätze"],
  "Gemeinschaftsraum": ["der", "Gemeinschaftsräume"],
  "Wohngemeinschaft": ["die", "Wohngemeinschaften"],
  "Altersgrenze": ["die", "Altersgrenzen"],
  "Grundstück": ["das", "Grundstücke"],
  "Freiwillige": ["der/die", "Freiwilligen"],
  "Praxisraum": ["der", "Praxisräume"],
  "Deutschkurs": ["der", "Deutschkurse"],
  "Laden": ["der", "Läden"],
  "Gruppe": ["die", "Gruppen"],
  "Heimatland": ["das", "Heimatländer"],
  "Bahn": ["die", "Bahnen"],
  "Kilometer": ["der", "Kilometer"],
  "Diskussionssendung": ["die", "Diskussionssendungen"],
  "Studierende": ["der/die", "Studierenden"],
  "Erlebnis": ["das", "Erlebnisse"],
  "Zuhörer": ["der", "Zuhörer"],
  "Süßigkeit": ["die", "Süßigkeiten"],
  "Sekretariat": ["das", "Sekretariate"],
  "Studio": ["das", "Studios"],